{
  "$schema": "https://json-schema.org/draft/2020-12/schema",
  "$id": "https://vadimcat.github.io/OnePageDocs/onepage-docs.schema.json",
  "title": "OnePageDocs project config",
  "description": "Optional onepage-docs.json in the folder opened with OnePageDocs. All fields are optional.",
  "type": "object",
  "additionalProperties": false,
  "properties": {
    "$schema": { "type": "string" },
    "_comment": { "type": "string" },
    "title": { "type": "string", "description": "Header and tab title. Defaults to the folder name." },
    "subtitle": { "type": "string" },
    "language": { "enum": ["ru", "en"], "description": "UI language. Defaults to the browser language." },
    "docsRoot": { "type": "string", "default": "auto", "description": "Docs folder relative to the opened folder. \"auto\" = docs/ if present, else the folder itself." },
    "includeOutside": { "type": "boolean", "default": true, "description": "Also show .md files outside docsRoot as the last group." },
    "groups": {
      "type": "array",
      "description": "Order and labels of sidebar groups. A group is a first-level folder inside docsRoot; \"\" is docsRoot itself.",
      "items": {
        "oneOf": [
          { "type": "string" },
          { "type": "object", "additionalProperties": false, "required": ["path"],
            "properties": { "path": { "type": "string" }, "label": { "type": "string" }, "hidden": { "type": "boolean" } } }
        ]
      }
    },
    "pin": { "type": "array", "items": { "type": "string" }, "description": "File names (without .md) or paths shown first in their group." },
    "last": { "type": "array", "items": { "type": "string" }, "description": "File names (without .md) or paths shown last in their group." },
    "skip": { "type": "array", "items": { "type": "string" }, "description": "Folder names not scanned (added to the built-in list)." },
    "generatedMarker": { "type": ["string", "array"], "items": { "type": "string" }, "description": "Text that marks a file as generated by a script." },
    "hideProps": { "type": "array", "items": { "type": "string" } },
    "propLabels": { "type": "object", "additionalProperties": { "type": "string" } },
    "status": {
      "type": "object", "additionalProperties": false,
      "description": "Case-insensitive regexes that colour property values. Checked in order bad → warn → ok.",
      "properties": {
        "bad": { "type": "array", "items": { "type": "string" } },
        "warn": { "type": "array", "items": { "type": "string" } },
        "ok": { "type": "array", "items": { "type": "string" } }
      }
    },
    "maxFiles": { "type": "integer", "minimum": 1, "default": 1500 }
  }
}
