{
  "title": "Sample Game",
  "subtitle": "GDD",
  "docsRoot": "docs",
  "groups": [
    { "path": "", "label": "Start" },
    { "path": "Systems", "label": "Systems" },
    { "path": "Tasks", "label": "Tasks" }
  ],
  "pin": ["00 Start"],
  "last": ["INDEX"],
  "generatedMarker": "Generated by script",
  "hideProps": ["project"],
  "propLabels": { "depends_on": "depends on" }
}
